2025-12-17 23:37:06,257 - logger name:log-common/AIR-Stream/topo_wo_edge_prompt-43/topo_wo_edge_prompt.log
2025-12-17 23:37:06,257 - Params: {'conf': 'conf/AIR.json', 'seed': 43, 'paral': 0, 'gpuid': 0, 'logname': 'topo_wo_edge_prompt', 'method': 'TopoPrompt', 'load_first_year': 0, 'first_year_model_path': 'log/PEMS3/topo-43/2011/14.7956.pkl', 'device': device(type='cuda', index=0), 'methods': {'TopoPrompt': <class 'src.models.model.TopoPrompt'>}, 'begin_year': 2016, 'end_year': 2019, 'dropout': 0.0, 'lr': 0.021, 'batch_size': 128, 'epoch': 100, 'loss': 'mse', 'activation': 'relu', 'scheduler': 'epo', 'y_len': 12, 'x_len': 12, 'data_process': 0, 'raw_data_path': '../autodl-tmp/data/AIR/RawData/', 'save_data_path': '../autodl-tmp/data/AIR/FastData/', 'graph_path': '../autodl-tmp/data/AIR/graph/', 'model_path': 'log-common/AIR-Stream', 'gcn': {'in_channel': 12, 'out_channel': 12, 'hidden_channel': 64}, 'tcn': {'in_channel': 1, 'out_channel': 1, 'kernel_size': 3, 'dilation': 1}, 'rank': 6, 'init': True, 'train': 1, 'auto_test': 1, 'strategy': 'retrain', 'path': 'log-common/AIR-Stream/topo_wo_edge_prompt-43', 'logger': <Logger utils.initialize (INFO)>}
2025-12-17 23:37:06,279 - [*] Year 2016 loaded from ../autodl-tmp/data/AIR/FastData/2016.npz
2025-12-17 23:37:08,140 - [*] Year 2016 Dataset load!
2025-12-17 23:37:08,144 - Total Parameters: 36389
2025-12-17 23:37:08,144 - Trainable Parameters: 36389
2025-12-17 23:37:08,144 - [*] Year 2016 Training start
2025-12-17 23:37:10,913 - node number torch.Size([139136, 12])
2025-12-17 23:37:16,285 - epoch:0, training loss:3314.8584 validation loss:23.2246
2025-12-17 23:37:23,786 - epoch:1, training loss:1314.8733 validation loss:23.3776
2025-12-17 23:37:31,594 - epoch:2, training loss:1219.0572 validation loss:21.2344
2025-12-17 23:37:39,087 - epoch:3, training loss:1197.8949 validation loss:20.6212
2025-12-17 23:37:46,695 - epoch:4, training loss:1181.4504 validation loss:21.0411
2025-12-17 23:37:54,281 - epoch:5, training loss:1176.4696 validation loss:17.8642
2025-12-17 23:38:03,194 - epoch:6, training loss:1174.8678 validation loss:19.6495
2025-12-17 23:38:12,897 - epoch:7, training loss:1165.3801 validation loss:17.8838
2025-12-17 23:38:22,560 - epoch:8, training loss:1170.1017 validation loss:19.8378
2025-12-17 23:38:32,098 - epoch:9, training loss:1184.6133 validation loss:21.3366
2025-12-17 23:38:41,502 - epoch:10, training loss:1179.4789 validation loss:17.1168
2025-12-17 23:38:50,889 - epoch:11, training loss:1195.6559 validation loss:21.5410
2025-12-17 23:39:00,196 - epoch:12, training loss:1204.7042 validation loss:28.4800
2025-12-17 23:39:09,398 - epoch:13, training loss:1207.2993 validation loss:19.1564
2025-12-17 23:39:18,803 - epoch:14, training loss:1160.5483 validation loss:23.5079
2025-12-17 23:39:28,204 - epoch:15, training loss:1176.6891 validation loss:21.4631
2025-12-17 23:39:37,414 - epoch:16, training loss:1150.0316 validation loss:21.6312
2025-12-17 23:39:41,127 - [*] loss:2531.8738
2025-12-17 23:39:41,252 - [*] year 2016, testing
2025-12-17 23:39:42,136 - T:3	MAE	24.4232	RMSE	39.4087	MAPE	25.2039
2025-12-17 23:39:43,888 - T:6	MAE	27.5843	RMSE	44.9106	MAPE	28.8996
2025-12-17 23:39:49,944 - T:12	MAE	31.1709	RMSE	50.7374	MAPE	33.2558
2025-12-17 23:39:49,945 - T:Avg	MAE	27.3939	RMSE	44.4192	MAPE	28.6972
2025-12-17 23:39:49,959 - Finished optimization, total time:91.22 s, best model:log-common/AIR-Stream/topo_wo_edge_prompt-43/2016/17.1168.pkl
2025-12-17 23:39:50,145 - [*] Year 2017 loaded from ../autodl-tmp/data/AIR/FastData/2017.npz
2025-12-17 23:39:51,840 - [*] Year 2017 Dataset load!
2025-12-17 23:39:51,840 - [*] load from log-common/AIR-Stream/topo_wo_edge_prompt-43/2016/17.1168.pkl
2025-12-17 23:39:51,855 - [*] Year 2017 Training start
2025-12-17 23:39:54,823 - node number torch.Size([147712, 12])
2025-12-17 23:39:58,667 - epoch:0, training loss:1213.7247 validation loss:25.9854
2025-12-17 23:40:05,098 - epoch:1, training loss:1172.5810 validation loss:25.5960
2025-12-17 23:40:11,544 - epoch:2, training loss:1173.3250 validation loss:26.6565
2025-12-17 23:40:18,168 - epoch:3, training loss:1173.6392 validation loss:27.3957
2025-12-17 23:40:24,660 - epoch:4, training loss:1170.6928 validation loss:25.8415
2025-12-17 23:40:31,378 - epoch:5, training loss:1168.0132 validation loss:25.8733
2025-12-17 23:40:38,586 - epoch:6, training loss:1161.0672 validation loss:25.9581
2025-12-17 23:40:44,804 - epoch:7, training loss:1167.8721 validation loss:26.6318
2025-12-17 23:40:47,797 - [*] loss:1423.4534
2025-12-17 23:40:47,902 - [*] year 2017, testing
2025-12-17 23:40:48,578 - T:3	MAE	17.6731	RMSE	26.1235	MAPE	22.1545
2025-12-17 23:40:50,448 - T:6	MAE	21.1288	RMSE	32.1093	MAPE	25.8572
2025-12-17 23:40:56,282 - T:12	MAE	24.9000	RMSE	38.0013	MAPE	30.3346
2025-12-17 23:40:56,282 - T:Avg	MAE	20.8649	RMSE	31.3811	MAPE	25.7292
2025-12-17 23:40:56,296 - Finished optimization, total time:27.90 s, best model:log-common/AIR-Stream/topo_wo_edge_prompt-43/2017/25.5960.pkl
2025-12-17 23:40:56,458 - [*] Year 2018 loaded from ../autodl-tmp/data/AIR/FastData/2018.npz
2025-12-17 23:40:58,170 - [*] Year 2018 Dataset load!
2025-12-17 23:40:58,170 - [*] load from log-common/AIR-Stream/topo_wo_edge_prompt-43/2017/25.5960.pkl
2025-12-17 23:40:58,178 - [*] Year 2018 Training start
2025-12-17 23:41:01,027 - node number torch.Size([152704, 12])
2025-12-17 23:41:04,815 - epoch:0, training loss:1095.2544 validation loss:26.3185
2025-12-17 23:41:11,416 - epoch:1, training loss:1071.8110 validation loss:25.5162
2025-12-17 23:41:17,997 - epoch:2, training loss:1075.3285 validation loss:26.7593
2025-12-17 23:41:24,500 - epoch:3, training loss:1070.4096 validation loss:27.3260
2025-12-17 23:41:30,977 - epoch:4, training loss:1084.2904 validation loss:26.7359
2025-12-17 23:41:38,509 - epoch:5, training loss:1065.4811 validation loss:24.5195
2025-12-17 23:41:45,183 - epoch:6, training loss:1068.1613 validation loss:23.9189
2025-12-17 23:41:51,786 - epoch:7, training loss:1082.3967 validation loss:26.3156
2025-12-17 23:41:58,363 - epoch:8, training loss:1060.7103 validation loss:25.1715
2025-12-17 23:42:04,995 - epoch:9, training loss:1062.8504 validation loss:24.8279
2025-12-17 23:42:11,568 - epoch:10, training loss:1075.0848 validation loss:25.9367
2025-12-17 23:42:18,109 - epoch:11, training loss:1062.2550 validation loss:26.6806
2025-12-17 23:42:24,800 - epoch:12, training loss:1063.1059 validation loss:24.5890
2025-12-17 23:42:27,865 - [*] loss:1133.1792
2025-12-17 23:42:27,981 - [*] year 2018, testing
2025-12-17 23:42:28,687 - T:3	MAE	12.9635	RMSE	22.8635	MAPE	20.2709
2025-12-17 23:42:30,573 - T:6	MAE	16.2437	RMSE	28.3762	MAPE	25.7813
2025-12-17 23:42:36,162 - T:12	MAE	19.6522	RMSE	33.7213	MAPE	32.0931
2025-12-17 23:42:36,163 - T:Avg	MAE	15.9108	RMSE	27.6603	MAPE	25.4031
2025-12-17 23:42:36,176 - Finished optimization, total time:45.41 s, best model:log-common/AIR-Stream/topo_wo_edge_prompt-43/2018/23.9189.pkl
2025-12-17 23:42:36,334 - [*] Year 2019 loaded from ../autodl-tmp/data/AIR/FastData/2019.npz
2025-12-17 23:42:37,999 - [*] Year 2019 Dataset load!
2025-12-17 23:42:37,999 - [*] load from log-common/AIR-Stream/topo_wo_edge_prompt-43/2018/23.9189.pkl
2025-12-17 23:42:38,006 - [*] Year 2019 Training start
2025-12-17 23:42:41,136 - node number torch.Size([153856, 12])
2025-12-17 23:42:45,056 - epoch:0, training loss:858.5941 validation loss:20.6426
2025-12-17 23:42:51,892 - epoch:1, training loss:843.9071 validation loss:22.1426
2025-12-17 23:42:58,807 - epoch:2, training loss:840.3136 validation loss:20.6043
2025-12-17 23:43:05,966 - epoch:3, training loss:842.7805 validation loss:21.9999
2025-12-17 23:43:13,096 - epoch:4, training loss:838.5823 validation loss:20.6712
2025-12-17 23:43:20,307 - epoch:5, training loss:837.9042 validation loss:20.3221
2025-12-17 23:43:27,488 - epoch:6, training loss:839.0927 validation loss:20.1442
2025-12-17 23:43:34,670 - epoch:7, training loss:835.5527 validation loss:21.5013
2025-12-17 23:43:41,803 - epoch:8, training loss:835.4913 validation loss:21.9628
2025-12-17 23:43:48,696 - epoch:9, training loss:838.1020 validation loss:21.3592
2025-12-17 23:43:55,585 - epoch:10, training loss:835.6975 validation loss:21.1823
2025-12-17 23:44:02,752 - epoch:11, training loss:835.4688 validation loss:21.3989
2025-12-17 23:44:09,794 - epoch:12, training loss:833.6587 validation loss:20.9855
2025-12-17 23:44:13,169 - [*] loss:1014.6995
2025-12-17 23:44:13,292 - [*] year 2019, testing
2025-12-17 23:44:14,004 - T:3	MAE	14.5386	RMSE	22.0795	MAPE	20.8021
2025-12-17 23:44:15,712 - T:6	MAE	17.4327	RMSE	27.1918	MAPE	24.8015
2025-12-17 23:44:21,486 - T:12	MAE	20.5453	RMSE	32.0886	MAPE	29.9702
2025-12-17 23:44:21,486 - T:Avg	MAE	17.1726	RMSE	26.4908	MAPE	24.7291
2025-12-17 23:44:21,500 - Finished optimization, total time:48.72 s, best model:log-common/AIR-Stream/topo_wo_edge_prompt-43/2019/20.1442.pkl
2025-12-17 23:44:21,643 - 

Evaluation Metrics Across Years:
2025-12-17 23:44:21,644 - 3   	MAE	     24.42	     17.67	     12.96	     14.54		   17.40
2025-12-17 23:44:21,644 - 3   	RMSE	     39.41	     26.12	     22.86	     22.08		   27.62
2025-12-17 23:44:21,644 - 3   	MAPE	     25.20	     22.15	     20.27	     20.80		   22.11
2025-12-17 23:44:21,644 - 6   	MAE	     27.58	     21.13	     16.24	     17.43		   20.60
2025-12-17 23:44:21,644 - 6   	RMSE	     44.91	     32.11	     28.38	     27.19		   33.15
2025-12-17 23:44:21,644 - 6   	MAPE	     28.90	     25.86	     25.78	     24.80		   26.33
2025-12-17 23:44:21,644 - 12  	MAE	     31.17	     24.90	     19.65	     20.55		   24.07
2025-12-17 23:44:21,644 - 12  	RMSE	     50.74	     38.00	     33.72	     32.09		   38.64
2025-12-17 23:44:21,644 - 12  	MAPE	     33.26	     30.33	     32.09	     29.97		   31.41
2025-12-17 23:44:21,644 - Avg 	MAE	     27.39	     20.86	     15.91	     17.17		   20.34
2025-12-17 23:44:21,644 - Avg 	RMSE	     44.42	     31.38	     27.66	     26.49		   32.49
2025-12-17 23:44:21,644 - Avg 	MAPE	     28.70	     25.73	     25.40	     24.73		   26.14
2025-12-17 23:44:21,644 - 
Training Time Statistics:
2025-12-17 23:44:21,644 - Year 2016 | Total Time:    91.2190s | Avg/Epoch:     5.3658s | Epochs: 17
2025-12-17 23:44:21,644 - Year 2017 | Total Time:    27.8953s | Avg/Epoch:     3.4869s | Epochs: 8
2025-12-17 23:44:21,644 - Year 2018 | Total Time:    45.4145s | Avg/Epoch:     3.4934s | Epochs: 13
2025-12-17 23:44:21,644 - Year 2019 | Total Time:    48.7220s | Avg/Epoch:     3.7478s | Epochs: 13
2025-12-17 23:44:21,644 - Total training time across all years: 213.2508s
