2025-12-17 23:56:49,119 - logger name:log-common/AIR-Stream/topo_wo_importance-43/topo_wo_importance.log
2025-12-17 23:56:49,119 - Params: {'conf': 'conf/AIR.json', 'seed': 43, 'paral': 0, 'gpuid': 0, 'logname': 'topo_wo_importance', 'method': 'TopoPrompt', 'load_first_year': 0, 'first_year_model_path': 'log/PEMS3/topo-43/2011/14.7956.pkl', 'device': device(type='cuda', index=0), 'methods': {'TopoPrompt': <class 'src.models.model.TopoPrompt'>}, 'begin_year': 2016, 'end_year': 2019, 'dropout': 0.0, 'lr': 0.021, 'batch_size': 128, 'epoch': 100, 'loss': 'mse', 'activation': 'relu', 'scheduler': 'epo', 'y_len': 12, 'x_len': 12, 'data_process': 0, 'raw_data_path': '../autodl-tmp/data/AIR/RawData/', 'save_data_path': '../autodl-tmp/data/AIR/FastData/', 'graph_path': '../autodl-tmp/data/AIR/graph/', 'model_path': 'log-common/AIR-Stream', 'gcn': {'in_channel': 12, 'out_channel': 12, 'hidden_channel': 64}, 'tcn': {'in_channel': 1, 'out_channel': 1, 'kernel_size': 3, 'dilation': 1}, 'rank': 6, 'init': True, 'train': 1, 'auto_test': 1, 'strategy': 'retrain', 'path': 'log-common/AIR-Stream/topo_wo_importance-43', 'logger': <Logger utils.initialize (INFO)>}
2025-12-17 23:56:49,142 - [*] Year 2016 loaded from ../autodl-tmp/data/AIR/FastData/2016.npz
2025-12-17 23:56:50,949 - [*] Year 2016 Dataset load!
2025-12-17 23:56:50,952 - Total Parameters: 36389
2025-12-17 23:56:50,952 - Trainable Parameters: 36389
2025-12-17 23:56:50,952 - [*] Year 2016 Training start
2025-12-17 23:56:53,415 - node number torch.Size([139136, 12])
2025-12-17 23:56:58,468 - epoch:0, training loss:3396.6224 validation loss:24.5472
2025-12-17 23:57:04,981 - epoch:1, training loss:1608.1191 validation loss:21.6551
2025-12-17 23:57:11,676 - epoch:2, training loss:1252.5800 validation loss:18.7214
2025-12-17 23:57:19,766 - epoch:3, training loss:1181.7875 validation loss:17.8081
2025-12-17 23:57:27,887 - epoch:4, training loss:1167.2013 validation loss:17.6608
2025-12-17 23:57:36,185 - epoch:5, training loss:1141.8079 validation loss:20.0219
2025-12-17 23:57:44,578 - epoch:6, training loss:1106.5555 validation loss:21.1582
2025-12-17 23:57:52,877 - epoch:7, training loss:1096.2672 validation loss:17.8022
2025-12-17 23:58:01,002 - epoch:8, training loss:1077.1640 validation loss:18.0823
2025-12-17 23:58:09,099 - epoch:9, training loss:1078.2675 validation loss:20.5156
2025-12-17 23:58:17,341 - epoch:10, training loss:1061.1131 validation loss:19.5333
2025-12-17 23:58:20,406 - [*] loss:2256.4861
2025-12-17 23:58:20,511 - [*] year 2016, testing
2025-12-17 23:58:21,338 - T:3	MAE	24.2888	RMSE	37.7161	MAPE	25.8304
2025-12-17 23:58:23,053 - T:6	MAE	26.9876	RMSE	42.5566	MAPE	28.9857
2025-12-17 23:58:28,756 - T:12	MAE	30.2092	RMSE	47.8276	MAPE	33.1365
2025-12-17 23:58:28,756 - T:Avg	MAE	26.8378	RMSE	42.1203	MAPE	28.9615
2025-12-17 23:58:28,770 - Finished optimization, total time:54.22 s, best model:log-common/AIR-Stream/topo_wo_importance-43/2016/17.6608.pkl
2025-12-17 23:58:28,928 - [*] Year 2017 loaded from ../autodl-tmp/data/AIR/FastData/2017.npz
2025-12-17 23:58:30,536 - [*] Year 2017 Dataset load!
2025-12-17 23:58:30,536 - [*] load from log-common/AIR-Stream/topo_wo_importance-43/2016/17.6608.pkl
2025-12-17 23:58:30,552 - [*] Year 2017 Training start
2025-12-17 23:58:33,351 - node number torch.Size([147712, 12])
2025-12-17 23:58:36,996 - epoch:0, training loss:1627.8999 validation loss:25.6207
2025-12-17 23:58:43,285 - epoch:1, training loss:1203.3754 validation loss:25.5653
2025-12-17 23:58:49,670 - epoch:2, training loss:1174.8367 validation loss:24.5473
2025-12-17 23:58:55,962 - epoch:3, training loss:1146.1211 validation loss:23.8786
2025-12-17 23:59:02,282 - epoch:4, training loss:1132.2226 validation loss:23.8884
2025-12-17 23:59:08,588 - epoch:5, training loss:1125.7097 validation loss:23.6893
2025-12-17 23:59:14,891 - epoch:6, training loss:1116.0851 validation loss:23.1876
2025-12-17 23:59:21,071 - epoch:7, training loss:1096.9320 validation loss:23.1926
2025-12-17 23:59:27,283 - epoch:8, training loss:1083.3712 validation loss:23.6843
2025-12-17 23:59:33,385 - epoch:9, training loss:1081.7095 validation loss:23.8721
2025-12-17 23:59:39,585 - epoch:10, training loss:1069.0419 validation loss:22.5657
2025-12-17 23:59:45,685 - epoch:11, training loss:1058.3962 validation loss:23.4847
2025-12-17 23:59:52,000 - epoch:12, training loss:1052.3069 validation loss:24.1405
2025-12-17 23:59:58,075 - epoch:13, training loss:1045.0431 validation loss:21.0714
2025-12-18 00:00:04,082 - epoch:14, training loss:1050.6486 validation loss:24.8762
2025-12-18 00:00:10,078 - epoch:15, training loss:1032.9751 validation loss:21.7320
2025-12-18 00:00:16,088 - epoch:16, training loss:1029.6160 validation loss:24.7770
2025-12-18 00:00:22,059 - epoch:17, training loss:1021.3201 validation loss:22.9448
2025-12-18 00:00:28,094 - epoch:18, training loss:1017.5182 validation loss:24.9286
2025-12-18 00:00:34,252 - epoch:19, training loss:1017.3584 validation loss:23.0579
2025-12-18 00:00:37,005 - [*] loss:1688.7377
2025-12-18 00:00:37,127 - [*] year 2017, testing
2025-12-18 00:00:37,825 - T:3	MAE	22.6151	RMSE	32.7199	MAPE	27.6249
2025-12-18 00:00:39,594 - T:6	MAE	24.8703	RMSE	36.8046	MAPE	29.3195
2025-12-18 00:00:45,393 - T:12	MAE	27.6256	RMSE	41.2861	MAPE	32.0029
2025-12-18 00:00:45,393 - T:Avg	MAE	24.7500	RMSE	36.4379	MAPE	29.4203
2025-12-18 00:00:45,407 - Finished optimization, total time:66.22 s, best model:log-common/AIR-Stream/topo_wo_importance-43/2017/21.0714.pkl
2025-12-18 00:00:45,559 - [*] Year 2018 loaded from ../autodl-tmp/data/AIR/FastData/2018.npz
2025-12-18 00:00:47,184 - [*] Year 2018 Dataset load!
2025-12-18 00:00:47,185 - [*] load from log-common/AIR-Stream/topo_wo_importance-43/2017/21.0714.pkl
2025-12-18 00:00:47,191 - [*] Year 2018 Training start
2025-12-18 00:00:50,130 - node number torch.Size([152704, 12])
2025-12-18 00:00:53,762 - epoch:0, training loss:1245.1249 validation loss:23.2414
2025-12-18 00:01:00,169 - epoch:1, training loss:1080.5463 validation loss:23.3721
2025-12-18 00:01:06,570 - epoch:2, training loss:1036.2499 validation loss:23.7050
2025-12-18 00:01:12,987 - epoch:3, training loss:1017.6896 validation loss:24.0767
2025-12-18 00:01:19,472 - epoch:4, training loss:1014.0180 validation loss:24.3472
2025-12-18 00:01:26,179 - epoch:5, training loss:991.0941 validation loss:24.9248
2025-12-18 00:01:32,550 - epoch:6, training loss:984.3780 validation loss:24.3185
2025-12-18 00:01:35,609 - [*] loss:1086.0449
2025-12-18 00:01:35,731 - [*] year 2018, testing
2025-12-18 00:01:36,466 - T:3	MAE	13.0905	RMSE	22.9113	MAPE	20.1975
2025-12-18 00:01:38,220 - T:6	MAE	16.1623	RMSE	27.9176	MAPE	25.4681
2025-12-18 00:01:44,011 - T:12	MAE	19.4848	RMSE	33.0077	MAPE	31.7392
2025-12-18 00:01:44,012 - T:Avg	MAE	15.8815	RMSE	27.3223	MAPE	25.2268
2025-12-18 00:01:44,025 - Finished optimization, total time:24.13 s, best model:log-common/AIR-Stream/topo_wo_importance-43/2018/23.2414.pkl
2025-12-18 00:01:44,193 - [*] Year 2019 loaded from ../autodl-tmp/data/AIR/FastData/2019.npz
2025-12-18 00:01:45,854 - [*] Year 2019 Dataset load!
2025-12-18 00:01:45,854 - [*] load from log-common/AIR-Stream/topo_wo_importance-43/2018/23.2414.pkl
2025-12-18 00:01:45,861 - [*] Year 2019 Training start
2025-12-18 00:01:48,899 - node number torch.Size([153856, 12])
2025-12-18 00:01:52,685 - epoch:0, training loss:898.0280 validation loss:18.7541
2025-12-18 00:01:59,285 - epoch:1, training loss:819.0279 validation loss:19.5197
2025-12-18 00:02:05,787 - epoch:2, training loss:799.6987 validation loss:19.5342
2025-12-18 00:02:12,158 - epoch:3, training loss:781.7762 validation loss:18.1432
2025-12-18 00:02:18,737 - epoch:4, training loss:767.7814 validation loss:18.5232
2025-12-18 00:02:25,290 - epoch:5, training loss:758.0691 validation loss:18.1789
2025-12-18 00:02:31,784 - epoch:6, training loss:754.3846 validation loss:18.8401
2025-12-18 00:02:38,279 - epoch:7, training loss:750.4039 validation loss:20.0462
2025-12-18 00:02:44,778 - epoch:8, training loss:738.3570 validation loss:17.9762
2025-12-18 00:02:51,386 - epoch:9, training loss:737.2290 validation loss:19.5954
2025-12-18 00:02:57,988 - epoch:10, training loss:731.1900 validation loss:19.5578
2025-12-18 00:03:04,452 - epoch:11, training loss:727.2140 validation loss:19.7855
2025-12-18 00:03:11,082 - epoch:12, training loss:729.5743 validation loss:19.0291
2025-12-18 00:03:17,480 - epoch:13, training loss:725.4446 validation loss:19.5968
2025-12-18 00:03:23,880 - epoch:14, training loss:719.7989 validation loss:18.9747
2025-12-18 00:03:26,930 - [*] loss:1077.1105
2025-12-18 00:03:27,056 - [*] year 2019, testing
2025-12-18 00:03:27,741 - T:3	MAE	16.8801	RMSE	25.2575	MAPE	24.0675
2025-12-18 00:03:29,498 - T:6	MAE	19.0237	RMSE	28.9354	MAPE	26.8263
2025-12-18 00:03:35,384 - T:12	MAE	21.6344	RMSE	32.9588	MAPE	30.8527
2025-12-18 00:03:35,384 - T:Avg	MAE	18.8998	RMSE	28.5773	MAPE	26.8877
2025-12-18 00:03:35,402 - Finished optimization, total time:51.97 s, best model:log-common/AIR-Stream/topo_wo_importance-43/2019/17.9762.pkl
2025-12-18 00:03:35,537 - 

Evaluation Metrics Across Years:
2025-12-18 00:03:35,537 - 3   	MAE	     24.29	     22.62	     13.09	     16.88		   19.22
2025-12-18 00:03:35,537 - 3   	RMSE	     37.72	     32.72	     22.91	     25.26		   29.65
2025-12-18 00:03:35,537 - 3   	MAPE	     25.83	     27.62	     20.20	     24.07		   24.43
2025-12-18 00:03:35,537 - 6   	MAE	     26.99	     24.87	     16.16	     19.02		   21.76
2025-12-18 00:03:35,537 - 6   	RMSE	     42.56	     36.80	     27.92	     28.94		   34.05
2025-12-18 00:03:35,537 - 6   	MAPE	     28.99	     29.32	     25.47	     26.83		   27.65
2025-12-18 00:03:35,537 - 12  	MAE	     30.21	     27.63	     19.48	     21.63		   24.74
2025-12-18 00:03:35,537 - 12  	RMSE	     47.83	     41.29	     33.01	     32.96		   38.77
2025-12-18 00:03:35,538 - 12  	MAPE	     33.14	     32.00	     31.74	     30.85		   31.93
2025-12-18 00:03:35,538 - Avg 	MAE	     26.84	     24.75	     15.88	     18.90		   21.59
2025-12-18 00:03:35,538 - Avg 	RMSE	     42.12	     36.44	     27.32	     28.58		   33.61
2025-12-18 00:03:35,538 - Avg 	MAPE	     28.96	     29.42	     25.23	     26.89		   27.62
2025-12-18 00:03:35,538 - 
Training Time Statistics:
2025-12-18 00:03:35,538 - Year 2016 | Total Time:    54.2186s | Avg/Epoch:     4.9290s | Epochs: 11
2025-12-18 00:03:35,538 - Year 2017 | Total Time:    66.2172s | Avg/Epoch:     3.3109s | Epochs: 20
2025-12-18 00:03:35,538 - Year 2018 | Total Time:    24.1328s | Avg/Epoch:     3.4475s | Epochs: 7
2025-12-18 00:03:35,538 - Year 2019 | Total Time:    51.9669s | Avg/Epoch:     3.4645s | Epochs: 15
2025-12-18 00:03:35,538 - Total training time across all years: 196.5355s
