2025-12-17 15:49:39,001 - logger name:log-common/PEMS-Stream/topo-43/topo.log
2025-12-17 15:49:39,002 - Params: {'conf': 'conf/PEMS3.json', 'seed': 43, 'paral': 0, 'gpuid': 0, 'logname': 'topo', 'method': 'TopoPrompt', 'load_first_year': 0, 'first_year_model_path': 'log/PEMS3/topo-43/2011/14.7956.pkl', 'device': device(type='cuda', index=0), 'methods': {'TopoPrompt': <class 'src.models.model.TopoPrompt'>}, 'begin_year': 2011, 'end_year': 2017, 'dropout': 0.0, 'lr': 0.03, 'batch_size': 64, 'epoch': 100, 'loss': 'mse', 'activation': 'relu', 'scheduler': 'epo', 'y_len': 12, 'x_len': 12, 'data_process': 0, 'raw_data_path': '../autodl-tmp/data1/PEMS3/finaldata/', 'save_data_path': '../autodl-tmp/data1/PEMS3/FastData/', 'graph_path': '../autodl-tmp/data1/PEMS3/graph/', 'model_path': 'log-common/PEMS-Stream', 'gcn': {'in_channel': 12, 'out_channel': 12, 'hidden_channel': 64}, 'tcn': {'in_channel': 1, 'out_channel': 1, 'kernel_size': 3, 'dilation': 1}, 'rank': 6, 'init': True, 'train': 1, 'auto_test': 1, 'strategy': 'retrain', 'path': 'log-common/PEMS-Stream/topo-43', 'logger': <Logger utils.initialize (INFO)>}
2025-12-17 15:49:39,014 - [*] Year 2011 loaded from ../autodl-tmp/data1/PEMS3/FastData/2011.npz
2025-12-17 15:49:40,329 - [*] Year 2011 Dataset load!
2025-12-17 15:49:40,434 - Total Parameters: 23429
2025-12-17 15:49:40,435 - Trainable Parameters: 23429
2025-12-17 15:49:40,436 - [*] Year 2011 Training start
2025-12-17 15:49:41,733 - node number torch.Size([41920, 12])
2025-12-17 15:49:45,302 - epoch:0, training loss:4141.9147 validation loss:23.7418
2025-12-17 15:49:49,511 - epoch:1, training loss:832.4099 validation loss:16.6010
2025-12-17 15:49:53,684 - epoch:2, training loss:538.3866 validation loss:15.6268
2025-12-17 15:49:57,810 - epoch:3, training loss:499.6147 validation loss:15.0526
2025-12-17 15:50:01,887 - epoch:4, training loss:478.9696 validation loss:16.3506
2025-12-17 15:50:05,810 - epoch:5, training loss:463.6421 validation loss:14.7963
2025-12-17 15:50:09,877 - epoch:6, training loss:436.7571 validation loss:13.9214
2025-12-17 15:50:13,868 - epoch:7, training loss:429.4836 validation loss:14.3368
2025-12-17 15:50:17,775 - epoch:8, training loss:430.2304 validation loss:13.6386
2025-12-17 15:50:21,685 - epoch:9, training loss:416.5335 validation loss:14.9420
2025-12-17 15:50:25,584 - epoch:10, training loss:407.0879 validation loss:13.5233
2025-12-17 15:50:29,491 - epoch:11, training loss:401.7739 validation loss:14.1590
2025-12-17 15:50:33,483 - epoch:12, training loss:390.5443 validation loss:13.4533
2025-12-17 15:50:37,496 - epoch:13, training loss:399.3418 validation loss:13.7800
2025-12-17 15:50:41,470 - epoch:14, training loss:389.4751 validation loss:13.6239
2025-12-17 15:50:45,395 - epoch:15, training loss:373.0590 validation loss:13.1699
2025-12-17 15:50:49,398 - epoch:16, training loss:378.7029 validation loss:14.1484
2025-12-17 15:50:53,495 - epoch:17, training loss:370.0397 validation loss:13.4826
2025-12-17 15:50:57,499 - epoch:18, training loss:384.4408 validation loss:15.1523
2025-12-17 15:51:01,410 - epoch:19, training loss:396.4525 validation loss:13.4741
2025-12-17 15:51:05,798 - epoch:20, training loss:364.0369 validation loss:13.1590
2025-12-17 15:51:09,883 - epoch:21, training loss:389.3450 validation loss:14.6538
2025-12-17 15:51:14,100 - epoch:22, training loss:387.9478 validation loss:14.4206
2025-12-17 15:51:18,267 - epoch:23, training loss:359.1761 validation loss:13.6163
2025-12-17 15:51:22,312 - epoch:24, training loss:361.3159 validation loss:13.3230
2025-12-17 15:51:26,396 - epoch:25, training loss:348.8729 validation loss:13.6219
2025-12-17 15:51:30,508 - epoch:26, training loss:378.9814 validation loss:13.0953
2025-12-17 15:51:34,587 - epoch:27, training loss:364.5448 validation loss:13.4105
2025-12-17 15:51:38,491 - epoch:28, training loss:346.7543 validation loss:12.9701
2025-12-17 15:51:42,483 - epoch:29, training loss:360.5624 validation loss:13.2537
2025-12-17 15:51:46,592 - epoch:30, training loss:337.9493 validation loss:13.6805
2025-12-17 15:51:50,577 - epoch:31, training loss:344.3725 validation loss:13.4006
2025-12-17 15:51:54,686 - epoch:32, training loss:361.1561 validation loss:12.7715
2025-12-17 15:51:58,788 - epoch:33, training loss:350.6817 validation loss:12.9752
2025-12-17 15:52:02,986 - epoch:34, training loss:352.6545 validation loss:13.0869
2025-12-17 15:52:07,081 - epoch:35, training loss:348.7245 validation loss:13.5335
2025-12-17 15:52:11,190 - epoch:36, training loss:341.1284 validation loss:13.0147
2025-12-17 15:52:15,289 - epoch:37, training loss:344.5700 validation loss:13.1084
2025-12-17 15:52:19,279 - epoch:38, training loss:346.8569 validation loss:16.7742
2025-12-17 15:52:20,712 - [*] loss:369.8973
2025-12-17 15:52:20,795 - [*] year 2011, testing
2025-12-17 15:52:21,288 - T:3	MAE	11.8614	RMSE	17.8390	MAPE	16.0240
2025-12-17 15:52:22,347 - T:6	MAE	12.1544	RMSE	18.3609	MAPE	16.3147
2025-12-17 15:52:25,739 - T:12	MAE	12.7758	RMSE	19.3428	MAPE	17.2193
2025-12-17 15:52:25,739 - T:Avg	MAE	12.1958	RMSE	18.4035	MAPE	16.4360
2025-12-17 15:52:25,751 - Finished optimization, total time:105.62 s, best model:log-common/PEMS-Stream/topo-43/2011/12.7715.pkl
2025-12-17 15:52:25,829 - [*] Year 2012 loaded from ../autodl-tmp/data1/PEMS3/FastData/2012.npz
2025-12-17 15:52:26,868 - [*] Year 2012 Dataset load!
2025-12-17 15:52:26,868 - [*] load from log-common/PEMS-Stream/topo-43/2011/12.7715.pkl
2025-12-17 15:52:26,881 - [*] Year 2012 Training start
2025-12-17 15:52:28,778 - node number torch.Size([45760, 12])
2025-12-17 15:52:31,599 - epoch:0, training loss:489.2780 validation loss:12.7838
2025-12-17 15:52:35,893 - epoch:1, training loss:379.1981 validation loss:12.7256
2025-12-17 15:52:40,395 - epoch:2, training loss:371.9929 validation loss:12.6561
2025-12-17 15:52:44,885 - epoch:3, training loss:365.9587 validation loss:12.5110
2025-12-17 15:52:49,301 - epoch:4, training loss:363.6332 validation loss:12.3775
2025-12-17 15:52:54,395 - epoch:5, training loss:361.6140 validation loss:12.4280
2025-12-17 15:52:59,408 - epoch:6, training loss:361.3621 validation loss:12.3946
2025-12-17 15:53:04,684 - epoch:7, training loss:356.6704 validation loss:12.3643
2025-12-17 15:53:10,093 - epoch:8, training loss:355.5725 validation loss:12.3170
2025-12-17 15:53:15,091 - epoch:9, training loss:357.1192 validation loss:12.1348
2025-12-17 15:53:20,207 - epoch:10, training loss:354.0999 validation loss:12.3857
2025-12-17 15:53:25,102 - epoch:11, training loss:360.1385 validation loss:12.6191
2025-12-17 15:53:30,513 - epoch:12, training loss:360.4166 validation loss:12.6343
2025-12-17 15:53:35,395 - epoch:13, training loss:352.1341 validation loss:12.2415
2025-12-17 15:53:41,018 - epoch:14, training loss:349.7698 validation loss:12.2431
2025-12-17 15:53:46,692 - epoch:15, training loss:348.3024 validation loss:12.2758
2025-12-17 15:53:48,784 - [*] loss:362.4278
2025-12-17 15:53:48,862 - [*] year 2012, testing
2025-12-17 15:53:49,324 - T:3	MAE	11.5312	RMSE	17.5923	MAPE	16.5140
2025-12-17 15:53:50,493 - T:6	MAE	11.8390	RMSE	18.1293	MAPE	16.9425
2025-12-17 15:53:54,343 - T:12	MAE	12.4641	RMSE	19.1062	MAPE	18.1073
2025-12-17 15:53:54,344 - T:Avg	MAE	11.8625	RMSE	18.1464	MAPE	17.0707
2025-12-17 15:53:54,353 - Finished optimization, total time:46.42 s, best model:log-common/PEMS-Stream/topo-43/2012/12.1348.pkl
2025-12-17 15:53:54,451 - [*] Year 2013 loaded from ../autodl-tmp/data1/PEMS3/FastData/2013.npz
2025-12-17 15:53:55,656 - [*] Year 2013 Dataset load!
2025-12-17 15:53:55,656 - [*] load from log-common/PEMS-Stream/topo-43/2012/12.1348.pkl
2025-12-17 15:53:55,663 - [*] Year 2013 Training start
2025-12-17 15:53:57,993 - node number torch.Size([50304, 12])
2025-12-17 15:54:01,404 - epoch:0, training loss:416.9724 validation loss:12.6935
2025-12-17 15:54:07,055 - epoch:1, training loss:342.3677 validation loss:12.5002
2025-12-17 15:54:12,558 - epoch:2, training loss:336.9598 validation loss:12.3992
2025-12-17 15:54:18,891 - epoch:3, training loss:334.1032 validation loss:12.2194
2025-12-17 15:54:24,401 - epoch:4, training loss:329.8064 validation loss:12.2009
2025-12-17 15:54:30,524 - epoch:5, training loss:330.5254 validation loss:12.3230
2025-12-17 15:54:36,226 - epoch:6, training loss:324.0750 validation loss:12.3939
2025-12-17 15:54:41,818 - epoch:7, training loss:330.5658 validation loss:12.3057
2025-12-17 15:54:47,496 - epoch:8, training loss:324.4052 validation loss:12.3017
2025-12-17 15:54:53,810 - epoch:9, training loss:322.1556 validation loss:12.4723
2025-12-17 15:54:59,609 - epoch:10, training loss:323.4647 validation loss:12.1279
2025-12-17 15:55:05,794 - epoch:11, training loss:321.8913 validation loss:12.5454
2025-12-17 15:55:11,510 - epoch:12, training loss:320.1510 validation loss:12.2496
2025-12-17 15:55:17,059 - epoch:13, training loss:320.2463 validation loss:12.4882
2025-12-17 15:55:22,609 - epoch:14, training loss:320.7263 validation loss:12.5910
2025-12-17 15:55:28,101 - epoch:15, training loss:320.3156 validation loss:12.2920
2025-12-17 15:55:33,507 - epoch:16, training loss:326.3954 validation loss:12.2299
2025-12-17 15:55:36,016 - [*] loss:364.6016
2025-12-17 15:55:36,102 - [*] year 2013, testing
2025-12-17 15:55:36,586 - T:3	MAE	11.1799	RMSE	17.5507	MAPE	15.8669
2025-12-17 15:55:37,789 - T:6	MAE	11.5011	RMSE	18.2125	MAPE	16.4026
2025-12-17 15:55:42,057 - T:12	MAE	12.0487	RMSE	19.1217	MAPE	17.5354
2025-12-17 15:55:42,057 - T:Avg	MAE	11.5294	RMSE	18.2107	MAPE	16.5076
2025-12-17 15:55:42,068 - Finished optimization, total time:55.79 s, best model:log-common/PEMS-Stream/topo-43/2013/12.1279.pkl
2025-12-17 15:55:42,191 - [*] Year 2014 loaded from ../autodl-tmp/data1/PEMS3/FastData/2014.npz
2025-12-17 15:55:43,483 - [*] Year 2014 Dataset load!
2025-12-17 15:55:43,483 - [*] load from log-common/PEMS-Stream/topo-43/2013/12.1279.pkl
2025-12-17 15:55:43,490 - [*] Year 2014 Training start
2025-12-17 15:55:46,456 - node number torch.Size([52608, 12])
2025-12-17 15:55:49,906 - epoch:0, training loss:536.7276 validation loss:13.4778
2025-12-17 15:55:55,496 - epoch:1, training loss:430.2946 validation loss:13.3937
2025-12-17 15:56:01,321 - epoch:2, training loss:421.9268 validation loss:13.4279
2025-12-17 15:56:07,102 - epoch:3, training loss:429.5198 validation loss:13.7951
2025-12-17 15:56:12,906 - epoch:4, training loss:427.6359 validation loss:13.2520
2025-12-17 15:56:18,607 - epoch:5, training loss:412.0035 validation loss:13.1755
2025-12-17 15:56:24,205 - epoch:6, training loss:416.8659 validation loss:13.4925
2025-12-17 15:56:30,300 - epoch:7, training loss:413.9943 validation loss:13.3920
2025-12-17 15:56:36,295 - epoch:8, training loss:410.7822 validation loss:13.2872
2025-12-17 15:56:42,287 - epoch:9, training loss:413.9057 validation loss:13.3378
2025-12-17 15:56:48,392 - epoch:10, training loss:412.0168 validation loss:13.4392
2025-12-17 15:56:54,526 - epoch:11, training loss:416.1270 validation loss:13.9634
2025-12-17 15:56:57,016 - [*] loss:385.6158
2025-12-17 15:56:57,101 - [*] year 2014, testing
2025-12-17 15:56:57,610 - T:3	MAE	11.7121	RMSE	18.4017	MAPE	17.7626
2025-12-17 15:56:58,880 - T:6	MAE	11.9773	RMSE	18.8841	MAPE	18.1858
2025-12-17 15:57:03,230 - T:12	MAE	12.5081	RMSE	19.7156	MAPE	19.3543
2025-12-17 15:57:03,230 - T:Avg	MAE	12.0193	RMSE	18.9212	MAPE	18.3353
2025-12-17 15:57:03,241 - Finished optimization, total time:40.07 s, best model:log-common/PEMS-Stream/topo-43/2014/13.1755.pkl
2025-12-17 15:57:03,363 - [*] Year 2015 loaded from ../autodl-tmp/data1/PEMS3/FastData/2015.npz
2025-12-17 15:57:04,672 - [*] Year 2015 Dataset load!
2025-12-17 15:57:04,672 - [*] load from log-common/PEMS-Stream/topo-43/2014/13.1755.pkl
2025-12-17 15:57:04,680 - [*] Year 2015 Training start
2025-12-17 15:57:07,103 - node number torch.Size([53376, 12])
2025-12-17 15:57:10,618 - epoch:0, training loss:494.0862 validation loss:12.8953
2025-12-17 15:57:16,370 - epoch:1, training loss:428.3434 validation loss:12.8131
2025-12-17 15:57:22,808 - epoch:2, training loss:419.2206 validation loss:13.0611
2025-12-17 15:57:28,906 - epoch:3, training loss:418.4191 validation loss:12.9995
2025-12-17 15:57:35,812 - epoch:4, training loss:417.0608 validation loss:12.7258
2025-12-17 15:57:41,699 - epoch:5, training loss:413.4265 validation loss:13.0250
2025-12-17 15:57:47,597 - epoch:6, training loss:412.9400 validation loss:12.7808
2025-12-17 15:57:53,484 - epoch:7, training loss:416.0167 validation loss:13.0372
2025-12-17 15:57:59,307 - epoch:8, training loss:404.7377 validation loss:13.0642
2025-12-17 15:58:05,100 - epoch:9, training loss:407.0919 validation loss:13.0313
2025-12-17 15:58:11,005 - epoch:10, training loss:404.0237 validation loss:13.3822
2025-12-17 15:58:13,616 - [*] loss:407.2172
2025-12-17 15:58:13,709 - [*] year 2015, testing
2025-12-17 15:58:14,256 - T:3	MAE	11.6499	RMSE	18.4158	MAPE	17.2767
2025-12-17 15:58:15,609 - T:6	MAE	12.0498	RMSE	19.2129	MAPE	17.7790
2025-12-17 15:58:20,454 - T:12	MAE	12.7096	RMSE	20.3391	MAPE	19.0028
2025-12-17 15:58:20,454 - T:Avg	MAE	12.0795	RMSE	19.2173	MAPE	17.9171
2025-12-17 15:58:20,465 - Finished optimization, total time:38.11 s, best model:log-common/PEMS-Stream/topo-43/2015/12.7258.pkl
2025-12-17 15:58:20,589 - [*] Year 2016 loaded from ../autodl-tmp/data1/PEMS3/FastData/2016.npz
2025-12-17 15:58:21,882 - [*] Year 2016 Dataset load!
2025-12-17 15:58:21,882 - [*] load from log-common/PEMS-Stream/topo-43/2015/12.7258.pkl
2025-12-17 15:58:21,889 - [*] Year 2016 Training start
2025-12-17 15:58:24,304 - node number torch.Size([54400, 12])
2025-12-17 15:58:28,074 - epoch:0, training loss:618.0871 validation loss:13.1270
2025-12-17 15:58:33,910 - epoch:1, training loss:472.0772 validation loss:12.8007
2025-12-17 15:58:39,976 - epoch:2, training loss:452.8476 validation loss:12.9376
2025-12-17 15:58:45,898 - epoch:3, training loss:445.1339 validation loss:12.6847
2025-12-17 15:58:51,707 - epoch:4, training loss:440.3874 validation loss:12.9372
2025-12-17 15:58:57,795 - epoch:5, training loss:438.6317 validation loss:12.6112
2025-12-17 15:59:04,298 - epoch:6, training loss:438.3089 validation loss:12.6535
2025-12-17 15:59:10,208 - epoch:7, training loss:442.4784 validation loss:12.6591
2025-12-17 15:59:16,105 - epoch:8, training loss:434.0468 validation loss:12.6752
2025-12-17 15:59:22,203 - epoch:9, training loss:434.0116 validation loss:12.6310
2025-12-17 15:59:28,217 - epoch:10, training loss:432.1106 validation loss:12.9933
2025-12-17 15:59:34,011 - epoch:11, training loss:433.7995 validation loss:13.0170
2025-12-17 15:59:36,707 - [*] loss:487.6693
2025-12-17 15:59:36,796 - [*] year 2016, testing
2025-12-17 15:59:37,358 - T:3	MAE	11.2847	RMSE	19.9660	MAPE	15.8915
2025-12-17 15:59:38,681 - T:6	MAE	11.6725	RMSE	20.9319	MAPE	16.3792
2025-12-17 15:59:43,900 - T:12	MAE	12.3042	RMSE	22.2215	MAPE	17.5644
2025-12-17 15:59:43,901 - T:Avg	MAE	11.6897	RMSE	20.8860	MAPE	16.5172
2025-12-17 15:59:43,912 - Finished optimization, total time:41.26 s, best model:log-common/PEMS-Stream/topo-43/2016/12.6112.pkl
2025-12-17 15:59:44,038 - [*] Year 2017 loaded from ../autodl-tmp/data1/PEMS3/FastData/2017.npz
2025-12-17 15:59:45,393 - [*] Year 2017 Dataset load!
2025-12-17 15:59:45,393 - [*] load from log-common/PEMS-Stream/topo-43/2016/12.6112.pkl
2025-12-17 15:59:45,400 - [*] Year 2017 Training start
2025-12-17 15:59:47,863 - node number torch.Size([55744, 12])
2025-12-17 15:59:51,594 - epoch:0, training loss:848.9102 validation loss:16.0806
2025-12-17 15:59:57,903 - epoch:1, training loss:599.8779 validation loss:15.1942
2025-12-17 16:00:03,919 - epoch:2, training loss:556.5525 validation loss:14.6880
2025-12-17 16:00:09,900 - epoch:3, training loss:540.0810 validation loss:14.6427
2025-12-17 16:00:15,974 - epoch:4, training loss:526.0669 validation loss:14.6436
2025-12-17 16:00:22,010 - epoch:5, training loss:517.2645 validation loss:14.3635
2025-12-17 16:00:28,904 - epoch:6, training loss:510.1783 validation loss:14.4773
2025-12-17 16:00:34,902 - epoch:7, training loss:506.1375 validation loss:14.4485
2025-12-17 16:00:40,794 - epoch:8, training loss:504.7010 validation loss:14.3005
2025-12-17 16:00:47,477 - epoch:9, training loss:502.9600 validation loss:14.5303
2025-12-17 16:00:53,461 - epoch:10, training loss:501.8825 validation loss:14.5202
2025-12-17 16:00:59,498 - epoch:11, training loss:498.3280 validation loss:14.2185
2025-12-17 16:01:05,695 - epoch:12, training loss:501.7269 validation loss:14.3978
2025-12-17 16:01:11,803 - epoch:13, training loss:493.2625 validation loss:14.1629
2025-12-17 16:01:17,716 - epoch:14, training loss:491.5365 validation loss:14.1955
2025-12-17 16:01:23,691 - epoch:15, training loss:492.4053 validation loss:14.1378
2025-12-17 16:01:30,021 - epoch:16, training loss:497.3059 validation loss:14.1566
2025-12-17 16:01:36,600 - epoch:17, training loss:490.0424 validation loss:14.3787
2025-12-17 16:01:42,704 - epoch:18, training loss:492.7922 validation loss:14.2096
2025-12-17 16:01:48,704 - epoch:19, training loss:577.1797 validation loss:14.6305
2025-12-17 16:01:54,914 - epoch:20, training loss:500.3455 validation loss:14.1520
2025-12-17 16:02:01,059 - epoch:21, training loss:492.5444 validation loss:14.5988
2025-12-17 16:02:03,704 - [*] loss:510.3323
2025-12-17 16:02:03,810 - [*] year 2017, testing
2025-12-17 16:02:04,355 - T:3	MAE	13.0670	RMSE	20.7632	MAPE	20.4457
2025-12-17 16:02:05,703 - T:6	MAE	13.4838	RMSE	21.5426	MAPE	21.0285
2025-12-17 16:02:10,345 - T:12	MAE	14.1845	RMSE	22.7225	MAPE	22.3290
2025-12-17 16:02:10,346 - T:Avg	MAE	13.4904	RMSE	21.5303	MAPE	21.1356
2025-12-17 16:02:10,357 - Finished optimization, total time:76.42 s, best model:log-common/PEMS-Stream/topo-43/2017/14.1378.pkl
2025-12-17 16:02:10,467 - 

Evaluation Metrics Across Years:
2025-12-17 16:02:10,467 - 3   	MAE	     11.86	     11.53	     11.18	     11.71	     11.65	     11.28	     13.07		   11.76
2025-12-17 16:02:10,467 - 3   	RMSE	     17.84	     17.59	     17.55	     18.40	     18.42	     19.97	     20.76		   18.65
2025-12-17 16:02:10,467 - 3   	MAPE	     16.02	     16.51	     15.87	     17.76	     17.28	     15.89	     20.45		   17.11
2025-12-17 16:02:10,468 - 6   	MAE	     12.15	     11.84	     11.50	     11.98	     12.05	     11.67	     13.48		   12.10
2025-12-17 16:02:10,468 - 6   	RMSE	     18.36	     18.13	     18.21	     18.88	     19.21	     20.93	     21.54		   19.32
2025-12-17 16:02:10,468 - 6   	MAPE	     16.31	     16.94	     16.40	     18.19	     17.78	     16.38	     21.03		   17.58
2025-12-17 16:02:10,468 - 12  	MAE	     12.78	     12.46	     12.05	     12.51	     12.71	     12.30	     14.18		   12.71
2025-12-17 16:02:10,468 - 12  	RMSE	     19.34	     19.11	     19.12	     19.72	     20.34	     22.22	     22.72		   20.37
2025-12-17 16:02:10,468 - 12  	MAPE	     17.22	     18.11	     17.54	     19.35	     19.00	     17.56	     22.33		   18.73
2025-12-17 16:02:10,468 - Avg 	MAE	     12.20	     11.86	     11.53	     12.02	     12.08	     11.69	     13.49		   12.12
2025-12-17 16:02:10,468 - Avg 	RMSE	     18.40	     18.15	     18.21	     18.92	     19.22	     20.89	     21.53		   19.33
2025-12-17 16:02:10,468 - Avg 	MAPE	     16.44	     17.07	     16.51	     18.34	     17.92	     16.52	     21.14		   17.70
2025-12-17 16:02:10,468 - 
Training Time Statistics:
2025-12-17 16:02:10,468 - Year 2011 | Total Time:   105.6186s | Avg/Epoch:     2.7082s | Epochs: 39
2025-12-17 16:02:10,468 - Year 2012 | Total Time:    46.4225s | Avg/Epoch:     2.9014s | Epochs: 16
2025-12-17 16:02:10,468 - Year 2013 | Total Time:    55.7933s | Avg/Epoch:     3.2820s | Epochs: 17
2025-12-17 16:02:10,468 - Year 2014 | Total Time:    40.0727s | Avg/Epoch:     3.3394s | Epochs: 12
2025-12-17 16:02:10,468 - Year 2015 | Total Time:    38.1052s | Avg/Epoch:     3.4641s | Epochs: 11
2025-12-17 16:02:10,468 - Year 2016 | Total Time:    41.2568s | Avg/Epoch:     3.4381s | Epochs: 12
2025-12-17 16:02:10,468 - Year 2017 | Total Time:    76.4188s | Avg/Epoch:     3.4736s | Epochs: 22
2025-12-17 16:02:10,468 - Total training time across all years: 403.6879s
