2025-12-17 23:26:38,717 - logger name:log-common/AIR-Stream/topo_wo_alpha-43/topo_wo_alpha.log
2025-12-17 23:26:38,717 - Params: {'conf': 'conf/AIR.json', 'seed': 43, 'paral': 0, 'gpuid': 0, 'logname': 'topo_wo_alpha', 'method': 'TopoPrompt', 'load_first_year': 0, 'first_year_model_path': 'log/PEMS3/topo-43/2011/14.7956.pkl', 'device': device(type='cuda', index=0), 'methods': {'TopoPrompt': <class 'src.models.model.TopoPrompt'>}, 'begin_year': 2016, 'end_year': 2019, 'dropout': 0.0, 'lr': 0.021, 'batch_size': 128, 'epoch': 100, 'loss': 'mse', 'activation': 'relu', 'scheduler': 'epo', 'y_len': 12, 'x_len': 12, 'data_process': 0, 'raw_data_path': '../autodl-tmp/data/AIR/RawData/', 'save_data_path': '../autodl-tmp/data/AIR/FastData/', 'graph_path': '../autodl-tmp/data/AIR/graph/', 'model_path': 'log-common/AIR-Stream', 'gcn': {'in_channel': 12, 'out_channel': 12, 'hidden_channel': 64}, 'tcn': {'in_channel': 1, 'out_channel': 1, 'kernel_size': 3, 'dilation': 1}, 'rank': 6, 'init': True, 'train': 1, 'auto_test': 1, 'strategy': 'retrain', 'path': 'log-common/AIR-Stream/topo_wo_alpha-43', 'logger': <Logger utils.initialize (INFO)>}
2025-12-17 23:26:38,740 - [*] Year 2016 loaded from ../autodl-tmp/data/AIR/FastData/2016.npz
2025-12-17 23:26:40,528 - [*] Year 2016 Dataset load!
2025-12-17 23:26:40,531 - Total Parameters: 36389
2025-12-17 23:26:40,531 - Trainable Parameters: 36389
2025-12-17 23:26:40,532 - [*] Year 2016 Training start
2025-12-17 23:26:42,943 - node number torch.Size([139136, 12])
2025-12-17 23:26:48,482 - epoch:0, training loss:2630.0824 validation loss:18.6670
2025-12-17 23:26:56,196 - epoch:1, training loss:1341.7232 validation loss:22.9474
2025-12-17 23:27:03,598 - epoch:2, training loss:1143.6685 validation loss:18.7474
2025-12-17 23:27:11,099 - epoch:3, training loss:1101.7288 validation loss:17.9660
2025-12-17 23:27:18,387 - epoch:4, training loss:1077.5637 validation loss:17.2545
2025-12-17 23:27:26,021 - epoch:5, training loss:1061.5079 validation loss:17.2915
2025-12-17 23:27:33,586 - epoch:6, training loss:1029.0310 validation loss:19.0136
2025-12-17 23:27:41,697 - epoch:7, training loss:1020.8944 validation loss:18.1142
2025-12-17 23:27:49,579 - epoch:8, training loss:998.5040 validation loss:20.6636
2025-12-17 23:27:58,056 - epoch:9, training loss:997.8249 validation loss:18.2100
2025-12-17 23:28:05,980 - epoch:10, training loss:1003.8291 validation loss:20.3295
2025-12-17 23:28:09,208 - [*] loss:2410.9441
2025-12-17 23:28:09,313 - [*] year 2016, testing
2025-12-17 23:28:10,117 - T:3	MAE	23.0321	RMSE	36.7016	MAPE	24.6802
2025-12-17 23:28:11,767 - T:6	MAE	26.7774	RMSE	43.0019	MAPE	28.5149
2025-12-17 23:28:17,535 - T:12	MAE	30.9915	RMSE	49.5058	MAPE	33.0015
2025-12-17 23:28:17,536 - T:Avg	MAE	26.4848	RMSE	42.2816	MAPE	28.2812
2025-12-17 23:28:17,549 - Finished optimization, total time:53.75 s, best model:log-common/AIR-Stream/topo_wo_alpha-43/2016/17.2545.pkl
2025-12-17 23:28:17,713 - [*] Year 2017 loaded from ../autodl-tmp/data/AIR/FastData/2017.npz
2025-12-17 23:28:19,491 - [*] Year 2017 Dataset load!
2025-12-17 23:28:19,491 - [*] load from log-common/AIR-Stream/topo_wo_alpha-43/2016/17.2545.pkl
2025-12-17 23:28:19,502 - [*] Year 2017 Training start
2025-12-17 23:28:22,466 - node number torch.Size([147712, 12])
2025-12-17 23:28:26,205 - epoch:0, training loss:1936.7817 validation loss:27.9809
2025-12-17 23:28:32,578 - epoch:1, training loss:1186.3638 validation loss:27.0899
2025-12-17 23:28:38,791 - epoch:2, training loss:1132.7079 validation loss:25.2854
2025-12-17 23:28:45,185 - epoch:3, training loss:1100.4218 validation loss:27.1804
2025-12-17 23:28:51,588 - epoch:4, training loss:1088.1358 validation loss:26.5076
2025-12-17 23:28:57,796 - epoch:5, training loss:1073.1932 validation loss:25.4933
2025-12-17 23:29:04,102 - epoch:6, training loss:1051.4521 validation loss:26.7690
2025-12-17 23:29:10,184 - epoch:7, training loss:1035.9132 validation loss:24.7811
2025-12-17 23:29:16,402 - epoch:8, training loss:1027.7529 validation loss:24.1528
2025-12-17 23:29:22,680 - epoch:9, training loss:1019.4666 validation loss:22.3591
2025-12-17 23:29:28,815 - epoch:10, training loss:1018.6118 validation loss:23.4910
2025-12-17 23:29:34,998 - epoch:11, training loss:1006.7617 validation loss:23.2634
2025-12-17 23:29:41,460 - epoch:12, training loss:1000.3502 validation loss:25.5855
2025-12-17 23:29:47,907 - epoch:13, training loss:1002.6304 validation loss:23.3079
2025-12-17 23:29:54,359 - epoch:14, training loss:1000.9358 validation loss:25.1659
2025-12-17 23:30:01,299 - epoch:15, training loss:994.0101 validation loss:22.0020
2025-12-17 23:30:07,765 - epoch:16, training loss:993.5655 validation loss:25.6580
2025-12-17 23:30:14,218 - epoch:17, training loss:978.3877 validation loss:23.0443
2025-12-17 23:30:20,605 - epoch:18, training loss:983.8575 validation loss:26.3197
2025-12-17 23:30:27,107 - epoch:19, training loss:976.8073 validation loss:23.0277
2025-12-17 23:30:33,510 - epoch:20, training loss:992.2840 validation loss:24.6328
2025-12-17 23:30:39,815 - epoch:21, training loss:981.9018 validation loss:23.4760
2025-12-17 23:30:42,789 - [*] loss:1603.1786
2025-12-17 23:30:42,910 - [*] year 2017, testing
2025-12-17 23:30:43,677 - T:3	MAE	20.0530	RMSE	29.1513	MAPE	24.2596
2025-12-17 23:30:45,405 - T:6	MAE	22.9705	RMSE	34.5418	MAPE	26.9256
2025-12-17 23:30:51,017 - T:12	MAE	26.4550	RMSE	40.2281	MAPE	30.4264
2025-12-17 23:30:51,018 - T:Avg	MAE	22.8468	RMSE	34.0113	MAPE	26.9304
2025-12-17 23:30:51,031 - Finished optimization, total time:73.80 s, best model:log-common/AIR-Stream/topo_wo_alpha-43/2017/22.0020.pkl
2025-12-17 23:30:51,196 - [*] Year 2018 loaded from ../autodl-tmp/data/AIR/FastData/2018.npz
2025-12-17 23:30:52,955 - [*] Year 2018 Dataset load!
2025-12-17 23:30:52,955 - [*] load from log-common/AIR-Stream/topo_wo_alpha-43/2017/22.0020.pkl
2025-12-17 23:30:52,962 - [*] Year 2018 Training start
2025-12-17 23:30:55,708 - node number torch.Size([152704, 12])
2025-12-17 23:30:59,338 - epoch:0, training loss:1384.2027 validation loss:28.2096
2025-12-17 23:31:05,687 - epoch:1, training loss:1048.2871 validation loss:25.1310
2025-12-17 23:31:12,211 - epoch:2, training loss:1023.9388 validation loss:24.4887
2025-12-17 23:31:18,601 - epoch:3, training loss:991.3690 validation loss:24.2904
2025-12-17 23:31:24,806 - epoch:4, training loss:977.7785 validation loss:24.5389
2025-12-17 23:31:31,749 - epoch:5, training loss:972.9694 validation loss:24.0473
2025-12-17 23:31:40,885 - epoch:6, training loss:956.1818 validation loss:23.6912
2025-12-17 23:31:50,097 - epoch:7, training loss:957.8854 validation loss:27.0098
2025-12-17 23:31:59,280 - epoch:8, training loss:948.9638 validation loss:24.3047
2025-12-17 23:32:08,585 - epoch:9, training loss:945.8749 validation loss:25.1602
2025-12-17 23:32:17,590 - epoch:10, training loss:937.1544 validation loss:25.3155
2025-12-17 23:32:26,562 - epoch:11, training loss:924.8146 validation loss:23.4276
2025-12-17 23:32:35,884 - epoch:12, training loss:943.7533 validation loss:25.3343
2025-12-17 23:32:45,091 - epoch:13, training loss:930.1559 validation loss:27.2576
2025-12-17 23:32:53,903 - epoch:14, training loss:924.2664 validation loss:29.0427
2025-12-17 23:33:02,987 - epoch:15, training loss:927.5023 validation loss:24.7057
2025-12-17 23:33:12,102 - epoch:16, training loss:916.1392 validation loss:24.8424
2025-12-17 23:33:21,384 - epoch:17, training loss:916.2738 validation loss:26.2606
2025-12-17 23:33:25,596 - [*] loss:1118.7345
2025-12-17 23:33:25,719 - [*] year 2018, testing
2025-12-17 23:33:26,487 - T:3	MAE	13.2583	RMSE	22.8181	MAPE	21.1923
2025-12-17 23:33:28,315 - T:6	MAE	16.4525	RMSE	28.1437	MAPE	26.4481
2025-12-17 23:33:34,331 - T:12	MAE	19.8376	RMSE	33.5003	MAPE	32.1312
2025-12-17 23:33:34,333 - T:Avg	MAE	16.1301	RMSE	27.4734	MAPE	25.9308
2025-12-17 23:33:34,349 - Finished optimization, total time:77.13 s, best model:log-common/AIR-Stream/topo_wo_alpha-43/2018/23.4276.pkl
2025-12-17 23:33:34,562 - [*] Year 2019 loaded from ../autodl-tmp/data/AIR/FastData/2019.npz
2025-12-17 23:33:36,296 - [*] Year 2019 Dataset load!
2025-12-17 23:33:36,296 - [*] load from log-common/AIR-Stream/topo_wo_alpha-43/2018/23.4276.pkl
2025-12-17 23:33:36,303 - [*] Year 2019 Training start
2025-12-17 23:33:38,782 - node number torch.Size([153856, 12])
2025-12-17 23:33:42,493 - epoch:0, training loss:1123.4328 validation loss:20.1070
2025-12-17 23:33:48,818 - epoch:1, training loss:812.6607 validation loss:19.8693
2025-12-17 23:33:55,302 - epoch:2, training loss:785.5826 validation loss:19.7166
2025-12-17 23:34:01,694 - epoch:3, training loss:766.3867 validation loss:19.7581
2025-12-17 23:34:07,868 - epoch:4, training loss:754.4478 validation loss:19.5128
2025-12-17 23:34:13,796 - epoch:5, training loss:744.5942 validation loss:18.9751
2025-12-17 23:34:19,808 - epoch:6, training loss:739.4847 validation loss:19.6555
2025-12-17 23:34:26,093 - epoch:7, training loss:729.0868 validation loss:19.6682
2025-12-17 23:34:32,286 - epoch:8, training loss:724.5575 validation loss:19.3072
2025-12-17 23:34:38,487 - epoch:9, training loss:718.9198 validation loss:19.6217
2025-12-17 23:34:44,868 - epoch:10, training loss:715.8053 validation loss:19.9528
2025-12-17 23:34:51,216 - epoch:11, training loss:711.2209 validation loss:20.2090
2025-12-17 23:34:54,091 - [*] loss:1021.9822
2025-12-17 23:34:54,208 - [*] year 2019, testing
2025-12-17 23:34:55,080 - T:3	MAE	15.0819	RMSE	22.6410	MAPE	21.9524
2025-12-17 23:34:56,946 - T:6	MAE	17.7268	RMSE	27.3565	MAPE	25.4676
2025-12-17 23:35:03,262 - T:12	MAE	20.8094	RMSE	32.1812	MAPE	30.0389
2025-12-17 23:35:03,263 - T:Avg	MAE	17.5958	RMSE	26.8264	MAPE	25.4586
2025-12-17 23:35:03,280 - Finished optimization, total time:40.16 s, best model:log-common/AIR-Stream/topo_wo_alpha-43/2019/18.9751.pkl
2025-12-17 23:35:03,405 - 

Evaluation Metrics Across Years:
2025-12-17 23:35:03,405 - 3   	MAE	     23.03	     20.05	     13.26	     15.08		   17.86
2025-12-17 23:35:03,405 - 3   	RMSE	     36.70	     29.15	     22.82	     22.64		   27.83
2025-12-17 23:35:03,405 - 3   	MAPE	     24.68	     24.26	     21.19	     21.95		   23.02
2025-12-17 23:35:03,405 - 6   	MAE	     26.78	     22.97	     16.45	     17.73		   20.98
2025-12-17 23:35:03,405 - 6   	RMSE	     43.00	     34.54	     28.14	     27.36		   33.26
2025-12-17 23:35:03,405 - 6   	MAPE	     28.51	     26.93	     26.45	     25.47		   26.84
2025-12-17 23:35:03,406 - 12  	MAE	     30.99	     26.45	     19.84	     20.81		   24.52
2025-12-17 23:35:03,406 - 12  	RMSE	     49.51	     40.23	     33.50	     32.18		   38.85
2025-12-17 23:35:03,406 - 12  	MAPE	     33.00	     30.43	     32.13	     30.04		   31.40
2025-12-17 23:35:03,406 - Avg 	MAE	     26.48	     22.85	     16.13	     17.60		   20.76
2025-12-17 23:35:03,406 - Avg 	RMSE	     42.28	     34.01	     27.47	     26.83		   32.65
2025-12-17 23:35:03,406 - Avg 	MAPE	     28.28	     26.93	     25.93	     25.46		   26.65
2025-12-17 23:35:03,406 - 
Training Time Statistics:
2025-12-17 23:35:03,406 - Year 2016 | Total Time:    53.7518s | Avg/Epoch:     4.8865s | Epochs: 11
2025-12-17 23:35:03,406 - Year 2017 | Total Time:    73.8016s | Avg/Epoch:     3.3546s | Epochs: 22
2025-12-17 23:35:03,406 - Year 2018 | Total Time:    77.1253s | Avg/Epoch:     4.2847s | Epochs: 18
2025-12-17 23:35:03,406 - Year 2019 | Total Time:    40.1622s | Avg/Epoch:     3.3469s | Epochs: 12
2025-12-17 23:35:03,406 - Total training time across all years: 244.8409s
