2025-12-18 17:19:22,865 - logger name:log-common/PEMS04-Stream/topo_wo_mask-43/topo_wo_mask.log
2025-12-18 17:19:22,865 - Params: {'conf': 'conf/PEMS4.json', 'seed': 43, 'paral': 0, 'gpuid': 0, 'logname': 'topo_wo_mask', 'method': 'TopoPrompt', 'load_first_year': 0, 'first_year_model_path': 'log/PEMS3/topo-43/2011/14.7956.pkl', 'device': device(type='cuda', index=0), 'methods': {'TopoPrompt': <class 'src.models.model.TopoPrompt'>}, 'begin_year': 2011, 'end_year': 2017, 'dropout': 0.0, 'lr': 0.03, 'batch_size': 64, 'epoch': 100, 'loss': 'mse', 'activation': 'relu', 'scheduler': 'epo', 'y_len': 12, 'x_len': 12, 'data_process': 0, 'raw_data_path': '../autodl-tmp/data1/PEMS4/finaldata/', 'save_data_path': '../autodl-tmp/data1/PEMS4/FastData/', 'graph_path': '../autodl-tmp/data1/PEMS4/graph/', 'model_path': 'log-common/PEMS04-Stream', 'gcn': {'in_channel': 12, 'out_channel': 12, 'hidden_channel': 64}, 'tcn': {'in_channel': 1, 'out_channel': 1, 'kernel_size': 3, 'dilation': 1}, 'rank': 6, 'init': True, 'train': 1, 'auto_test': 1, 'strategy': 'retrain', 'path': 'log-common/PEMS04-Stream/topo_wo_mask-43', 'logger': <Logger utils.initialize (INFO)>}
2025-12-18 17:19:22,868 - [*] Year 2011 loaded from ../autodl-tmp/data1/PEMS4/FastData/2011.npz
2025-12-18 17:19:23,303 - [*] Year 2011 Dataset load!
2025-12-18 17:19:23,326 - Total Parameters: 9179
2025-12-18 17:19:23,326 - Trainable Parameters: 9179
2025-12-18 17:19:23,327 - [*] Year 2011 Training start
2025-12-18 17:19:24,687 - node number torch.Size([11520, 12])
2025-12-18 17:19:27,099 - epoch:0, training loss:303.5737 validation loss:2.2463
2025-12-18 17:19:29,676 - epoch:1, training loss:12.4135 validation loss:1.9593
2025-12-18 17:19:32,290 - epoch:2, training loss:11.4727 validation loss:2.1561
2025-12-18 17:19:34,882 - epoch:3, training loss:11.2026 validation loss:1.9399
2025-12-18 17:19:37,203 - epoch:4, training loss:11.0008 validation loss:1.9233
2025-12-18 17:19:39,821 - epoch:5, training loss:10.7169 validation loss:1.9515
2025-12-18 17:19:42,339 - epoch:6, training loss:10.4818 validation loss:1.8710
2025-12-18 17:19:44,684 - epoch:7, training loss:10.3415 validation loss:1.8767
2025-12-18 17:19:47,272 - epoch:8, training loss:10.1427 validation loss:1.8498
2025-12-18 17:19:49,904 - epoch:9, training loss:9.9704 validation loss:1.7968
2025-12-18 17:19:52,603 - epoch:10, training loss:9.7945 validation loss:1.8119
2025-12-18 17:19:55,704 - epoch:11, training loss:9.9458 validation loss:2.5208
2025-12-18 17:19:58,365 - epoch:12, training loss:9.8316 validation loss:1.8052
2025-12-18 17:20:00,874 - epoch:13, training loss:9.5113 validation loss:1.7491
2025-12-18 17:20:03,405 - epoch:14, training loss:9.2410 validation loss:1.9239
2025-12-18 17:20:05,906 - epoch:15, training loss:9.5322 validation loss:1.8463
2025-12-18 17:20:08,597 - epoch:16, training loss:9.0387 validation loss:2.2734
2025-12-18 17:20:11,288 - epoch:17, training loss:9.6543 validation loss:2.2584
2025-12-18 17:20:14,002 - epoch:18, training loss:9.1400 validation loss:1.7151
2025-12-18 17:20:16,914 - epoch:19, training loss:8.7865 validation loss:2.0462
2025-12-18 17:20:19,542 - epoch:20, training loss:9.0775 validation loss:1.8595
2025-12-18 17:20:22,094 - epoch:21, training loss:8.6807 validation loss:1.6858
2025-12-18 17:20:24,617 - epoch:22, training loss:8.8298 validation loss:2.0217
2025-12-18 17:20:27,198 - epoch:23, training loss:8.4442 validation loss:1.7449
2025-12-18 17:20:29,788 - epoch:24, training loss:8.7072 validation loss:1.8210
2025-12-18 17:20:32,477 - epoch:25, training loss:8.8723 validation loss:2.5028
2025-12-18 17:20:35,213 - epoch:26, training loss:8.8424 validation loss:1.7156
2025-12-18 17:20:37,895 - epoch:27, training loss:8.3305 validation loss:1.8894
2025-12-18 17:20:38,819 - [*] loss:10.9902
2025-12-18 17:20:38,846 - [*] year 2011, testing
2025-12-18 17:20:38,973 - T:3	MAE	1.3079	RMSE	2.3901	MAPE	2.4874
2025-12-18 17:20:39,268 - T:6	MAE	1.4498	RMSE	2.8086	MAPE	2.8356
2025-12-18 17:20:40,285 - T:12	MAE	1.6555	RMSE	3.3339	MAPE	3.3204
2025-12-18 17:20:40,285 - T:Avg	MAE	1.4486	RMSE	2.7895	MAPE	2.8311
2025-12-18 17:20:40,293 - Finished optimization, total time:49.32 s, best model:log-common/PEMS04-Stream/topo_wo_mask-43/2011/1.6858.pkl
2025-12-18 17:20:40,374 - [*] Year 2012 loaded from ../autodl-tmp/data1/PEMS4/FastData/2012.npz
2025-12-18 17:20:40,773 - [*] Year 2012 Dataset load!
2025-12-18 17:20:40,773 - [*] load from log-common/PEMS04-Stream/topo_wo_mask-43/2011/1.6858.pkl
2025-12-18 17:20:40,786 - [*] Year 2012 Training start
2025-12-18 17:20:41,996 - node number torch.Size([12672, 12])
2025-12-18 17:20:44,016 - epoch:0, training loss:26.3379 validation loss:2.1007
2025-12-18 17:20:46,962 - epoch:1, training loss:10.0820 validation loss:1.7354
2025-12-18 17:20:49,730 - epoch:2, training loss:9.1586 validation loss:1.6517
2025-12-18 17:20:52,555 - epoch:3, training loss:8.7335 validation loss:1.7294
2025-12-18 17:20:55,522 - epoch:4, training loss:8.6130 validation loss:1.6105
2025-12-18 17:20:58,442 - epoch:5, training loss:8.5405 validation loss:1.5759
2025-12-18 17:21:01,216 - epoch:6, training loss:8.5301 validation loss:1.6018
2025-12-18 17:21:04,026 - epoch:7, training loss:8.4892 validation loss:1.5946
2025-12-18 17:21:06,918 - epoch:8, training loss:8.4842 validation loss:1.8202
2025-12-18 17:21:09,805 - epoch:9, training loss:8.4356 validation loss:1.8213
2025-12-18 17:21:12,725 - epoch:10, training loss:8.3376 validation loss:1.5656
2025-12-18 17:21:15,315 - epoch:11, training loss:8.5079 validation loss:1.5434
2025-12-18 17:21:18,212 - epoch:12, training loss:8.4299 validation loss:1.6538
2025-12-18 17:21:21,021 - epoch:13, training loss:8.4625 validation loss:1.5782
2025-12-18 17:21:23,815 - epoch:14, training loss:8.4733 validation loss:1.7883
2025-12-18 17:21:26,701 - epoch:15, training loss:8.3676 validation loss:1.6083
2025-12-18 17:21:29,712 - epoch:16, training loss:8.2662 validation loss:1.9592
2025-12-18 17:21:32,556 - epoch:17, training loss:8.3460 validation loss:1.6685
2025-12-18 17:21:33,556 - [*] loss:10.4155
2025-12-18 17:21:33,591 - [*] year 2012, testing
2025-12-18 17:21:33,702 - T:3	MAE	1.2391	RMSE	2.2772	MAPE	2.3086
2025-12-18 17:21:33,907 - T:6	MAE	1.3965	RMSE	2.7378	MAPE	2.6775
2025-12-18 17:21:34,550 - T:12	MAE	1.6021	RMSE	3.3171	MAPE	3.1696
2025-12-18 17:21:34,550 - T:Avg	MAE	1.3893	RMSE	2.7155	MAPE	2.6663
2025-12-18 17:21:34,551 - Finished optimization, total time:32.69 s, best model:log-common/PEMS04-Stream/topo_wo_mask-43/2012/1.5434.pkl
2025-12-18 17:21:34,579 - [*] Year 2013 loaded from ../autodl-tmp/data1/PEMS4/FastData/2013.npz
2025-12-18 17:21:34,911 - [*] Year 2013 Dataset load!
2025-12-18 17:21:34,911 - [*] load from log-common/PEMS04-Stream/topo_wo_mask-43/2012/1.5434.pkl
2025-12-18 17:21:34,918 - [*] Year 2013 Training start
2025-12-18 17:21:36,255 - node number torch.Size([13632, 12])
2025-12-18 17:21:38,215 - epoch:0, training loss:34.4834 validation loss:2.3222
2025-12-18 17:21:41,030 - epoch:1, training loss:14.3185 validation loss:2.2028
2025-12-18 17:21:43,813 - epoch:2, training loss:13.6793 validation loss:2.1518
2025-12-18 17:21:46,718 - epoch:3, training loss:13.2590 validation loss:2.2070
2025-12-18 17:21:49,825 - epoch:4, training loss:13.1747 validation loss:2.1274
2025-12-18 17:21:53,014 - epoch:5, training loss:12.8162 validation loss:2.1640
2025-12-18 17:21:56,546 - epoch:6, training loss:12.8810 validation loss:2.1594
2025-12-18 17:21:59,728 - epoch:7, training loss:12.7542 validation loss:2.1785
2025-12-18 17:22:02,951 - epoch:8, training loss:12.5212 validation loss:2.0762
2025-12-18 17:22:06,116 - epoch:9, training loss:12.7327 validation loss:2.1255
2025-12-18 17:22:09,182 - epoch:10, training loss:12.4367 validation loss:2.0878
2025-12-18 17:22:12,424 - epoch:11, training loss:12.3243 validation loss:2.0926
2025-12-18 17:22:15,615 - epoch:12, training loss:12.2789 validation loss:2.1725
2025-12-18 17:22:18,858 - epoch:13, training loss:12.4698 validation loss:2.1593
2025-12-18 17:22:21,937 - epoch:14, training loss:12.2240 validation loss:2.3496
2025-12-18 17:22:23,122 - [*] loss:14.3307
2025-12-18 17:22:23,161 - [*] year 2013, testing
2025-12-18 17:22:23,304 - T:3	MAE	1.5246	RMSE	2.6462	MAPE	3.0286
2025-12-18 17:22:23,526 - T:6	MAE	1.7474	RMSE	3.1799	MAPE	3.5544
2025-12-18 17:22:24,428 - T:12	MAE	2.0756	RMSE	3.8853	MAPE	4.3373
2025-12-18 17:22:24,428 - T:Avg	MAE	1.7500	RMSE	3.1648	MAPE	3.5650
2025-12-18 17:22:24,428 - Finished optimization, total time:28.79 s, best model:log-common/PEMS04-Stream/topo_wo_mask-43/2013/2.0762.pkl
2025-12-18 17:22:24,462 - [*] Year 2014 loaded from ../autodl-tmp/data1/PEMS4/FastData/2014.npz
2025-12-18 17:22:24,815 - [*] Year 2014 Dataset load!
2025-12-18 17:22:24,815 - [*] load from log-common/PEMS04-Stream/topo_wo_mask-43/2013/2.0762.pkl
2025-12-18 17:22:24,823 - [*] Year 2014 Training start
2025-12-18 17:22:26,224 - node number torch.Size([14400, 12])
2025-12-18 17:22:28,327 - epoch:0, training loss:37.2038 validation loss:2.2106
2025-12-18 17:22:31,412 - epoch:1, training loss:13.8326 validation loss:2.0792
2025-12-18 17:22:34,432 - epoch:2, training loss:13.2060 validation loss:2.1327
2025-12-18 17:22:37,599 - epoch:3, training loss:12.8940 validation loss:2.0528
2025-12-18 17:22:40,915 - epoch:4, training loss:12.6278 validation loss:2.0331
2025-12-18 17:22:43,752 - epoch:5, training loss:12.5490 validation loss:1.9825
2025-12-18 17:22:46,606 - epoch:6, training loss:12.3520 validation loss:2.0347
2025-12-18 17:22:49,417 - epoch:7, training loss:12.3383 validation loss:2.0057
2025-12-18 17:22:52,221 - epoch:8, training loss:12.1499 validation loss:2.0603
2025-12-18 17:22:55,070 - epoch:9, training loss:12.1526 validation loss:2.3219
2025-12-18 17:22:57,694 - epoch:10, training loss:12.0649 validation loss:1.9671
2025-12-18 17:23:00,554 - epoch:11, training loss:12.0284 validation loss:2.1268
2025-12-18 17:23:04,227 - epoch:12, training loss:12.0056 validation loss:1.9490
2025-12-18 17:23:07,155 - epoch:13, training loss:12.0260 validation loss:2.0293
2025-12-18 17:23:10,219 - epoch:14, training loss:11.9859 validation loss:2.0612
2025-12-18 17:23:13,349 - epoch:15, training loss:11.9451 validation loss:2.3806
2025-12-18 17:23:16,323 - epoch:16, training loss:11.9374 validation loss:1.9834
2025-12-18 17:23:19,445 - epoch:17, training loss:11.8711 validation loss:2.0097
2025-12-18 17:23:22,616 - epoch:18, training loss:11.8514 validation loss:2.2397
2025-12-18 17:23:23,923 - [*] loss:12.9554
2025-12-18 17:23:23,961 - [*] year 2014, testing
2025-12-18 17:23:24,093 - T:3	MAE	1.3977	RMSE	2.3916	MAPE	2.5759
2025-12-18 17:23:24,335 - T:6	MAE	1.5752	RMSE	2.9270	MAPE	3.0044
2025-12-18 17:23:25,354 - T:12	MAE	1.8470	RMSE	3.6282	MAPE	3.6504
2025-12-18 17:23:25,354 - T:Avg	MAE	1.5786	RMSE	2.9114	MAPE	3.0143
2025-12-18 17:23:25,355 - Finished optimization, total time:35.66 s, best model:log-common/PEMS04-Stream/topo_wo_mask-43/2014/1.9490.pkl
2025-12-18 17:23:25,382 - [*] Year 2015 loaded from ../autodl-tmp/data1/PEMS4/FastData/2015.npz
2025-12-18 17:23:25,761 - [*] Year 2015 Dataset load!
2025-12-18 17:23:25,761 - [*] load from log-common/PEMS04-Stream/topo_wo_mask-43/2014/1.9490.pkl
2025-12-18 17:23:25,768 - [*] Year 2015 Training start
2025-12-18 17:23:27,176 - node number torch.Size([15040, 12])
2025-12-18 17:23:29,332 - epoch:0, training loss:32.1853 validation loss:2.1410
2025-12-18 17:23:32,416 - epoch:1, training loss:12.5056 validation loss:2.0174
2025-12-18 17:23:35,616 - epoch:2, training loss:11.9622 validation loss:2.0167
2025-12-18 17:23:38,931 - epoch:3, training loss:11.7392 validation loss:2.0507
2025-12-18 17:23:42,114 - epoch:4, training loss:11.4982 validation loss:2.1701
2025-12-18 17:23:45,321 - epoch:5, training loss:11.3997 validation loss:2.0335
2025-12-18 17:23:48,453 - epoch:6, training loss:11.2744 validation loss:2.0400
2025-12-18 17:23:51,739 - epoch:7, training loss:11.1848 validation loss:2.0717
2025-12-18 17:23:54,643 - epoch:8, training loss:11.0727 validation loss:1.9610
2025-12-18 17:23:58,295 - epoch:9, training loss:11.0724 validation loss:2.5883
2025-12-18 17:24:01,339 - epoch:10, training loss:11.2795 validation loss:2.0737
2025-12-18 17:24:04,218 - epoch:11, training loss:10.9527 validation loss:2.0182
2025-12-18 17:24:07,128 - epoch:12, training loss:10.8648 validation loss:1.9792
2025-12-18 17:24:10,040 - epoch:13, training loss:10.8748 validation loss:1.9281
2025-12-18 17:24:12,918 - epoch:14, training loss:10.7333 validation loss:2.0976
2025-12-18 17:24:15,815 - epoch:15, training loss:10.8178 validation loss:2.0626
2025-12-18 17:24:19,023 - epoch:16, training loss:11.2065 validation loss:2.0576
2025-12-18 17:24:22,130 - epoch:17, training loss:10.6273 validation loss:2.2589
2025-12-18 17:24:25,426 - epoch:18, training loss:10.7276 validation loss:2.0586
2025-12-18 17:24:28,611 - epoch:19, training loss:10.5859 validation loss:2.0538
2025-12-18 17:24:29,790 - [*] loss:12.8894
2025-12-18 17:24:29,822 - [*] year 2015, testing
2025-12-18 17:24:29,963 - T:3	MAE	1.3982	RMSE	2.5181	MAPE	2.7199
2025-12-18 17:24:30,231 - T:6	MAE	1.6002	RMSE	3.0452	MAPE	3.1832
2025-12-18 17:24:31,219 - T:12	MAE	1.9005	RMSE	3.7206	MAPE	3.8563
2025-12-18 17:24:31,219 - T:Avg	MAE	1.6029	RMSE	3.0237	MAPE	3.1862
2025-12-18 17:24:31,219 - Finished optimization, total time:38.61 s, best model:log-common/PEMS04-Stream/topo_wo_mask-43/2015/1.9281.pkl
2025-12-18 17:24:31,250 - [*] Year 2016 loaded from ../autodl-tmp/data1/PEMS4/FastData/2016.npz
2025-12-18 17:24:31,625 - [*] Year 2016 Dataset load!
2025-12-18 17:24:31,626 - [*] load from log-common/PEMS04-Stream/topo_wo_mask-43/2015/1.9281.pkl
2025-12-18 17:24:31,632 - [*] Year 2016 Training start
2025-12-18 17:24:33,075 - node number torch.Size([15552, 12])
2025-12-18 17:24:35,221 - epoch:0, training loss:27.5689 validation loss:2.3572
2025-12-18 17:24:38,321 - epoch:1, training loss:13.8224 validation loss:2.2223
2025-12-18 17:24:41,439 - epoch:2, training loss:13.3194 validation loss:2.2857
2025-12-18 17:24:44,621 - epoch:3, training loss:13.0291 validation loss:2.1762
2025-12-18 17:24:47,816 - epoch:4, training loss:12.9204 validation loss:2.1842
2025-12-18 17:24:50,915 - epoch:5, training loss:12.8291 validation loss:2.2388
2025-12-18 17:24:54,220 - epoch:6, training loss:12.8553 validation loss:2.1575
2025-12-18 17:24:57,426 - epoch:7, training loss:12.8369 validation loss:2.1574
2025-12-18 17:25:00,528 - epoch:8, training loss:12.5425 validation loss:2.3743
2025-12-18 17:25:03,712 - epoch:9, training loss:12.5619 validation loss:2.4156
2025-12-18 17:25:06,912 - epoch:10, training loss:12.4458 validation loss:2.2102
2025-12-18 17:25:10,216 - epoch:11, training loss:12.2639 validation loss:2.1292
2025-12-18 17:25:13,529 - epoch:12, training loss:12.2765 validation loss:2.2225
2025-12-18 17:25:16,714 - epoch:13, training loss:12.3126 validation loss:2.1566
2025-12-18 17:25:19,521 - epoch:14, training loss:12.2519 validation loss:2.1500
2025-12-18 17:25:22,427 - epoch:15, training loss:12.1029 validation loss:2.2300
2025-12-18 17:25:25,418 - epoch:16, training loss:12.2796 validation loss:2.1700
2025-12-18 17:25:28,435 - epoch:17, training loss:12.0010 validation loss:2.1408
2025-12-18 17:25:29,612 - [*] loss:16.4534
2025-12-18 17:25:29,652 - [*] year 2016, testing
2025-12-18 17:25:29,794 - T:3	MAE	1.6350	RMSE	2.8599	MAPE	3.4296
2025-12-18 17:25:30,062 - T:6	MAE	1.8601	RMSE	3.4412	MAPE	3.9957
2025-12-18 17:25:31,152 - T:12	MAE	2.1818	RMSE	4.1993	MAPE	4.8218
2025-12-18 17:25:31,153 - T:Avg	MAE	1.8585	RMSE	3.4216	MAPE	3.9996
2025-12-18 17:25:31,153 - Finished optimization, total time:34.54 s, best model:log-common/PEMS04-Stream/topo_wo_mask-43/2016/2.1292.pkl
2025-12-18 17:25:31,183 - [*] Year 2017 loaded from ../autodl-tmp/data1/PEMS4/FastData/2017.npz
2025-12-18 17:25:31,612 - [*] Year 2017 Dataset load!
2025-12-18 17:25:31,613 - [*] load from log-common/PEMS04-Stream/topo_wo_mask-43/2016/2.1292.pkl
2025-12-18 17:25:31,619 - [*] Year 2017 Training start
2025-12-18 17:25:33,065 - node number torch.Size([15872, 12])
2025-12-18 17:25:35,283 - epoch:0, training loss:32.5174 validation loss:2.0786
2025-12-18 17:25:38,433 - epoch:1, training loss:15.6166 validation loss:2.1176
2025-12-18 17:25:41,928 - epoch:2, training loss:15.1325 validation loss:2.1237
2025-12-18 17:25:45,126 - epoch:3, training loss:14.8546 validation loss:2.0471
2025-12-18 17:25:48,575 - epoch:4, training loss:14.6571 validation loss:2.3483
2025-12-18 17:25:52,120 - epoch:5, training loss:14.5371 validation loss:2.0520
2025-12-18 17:25:55,313 - epoch:6, training loss:14.3429 validation loss:2.0688
2025-12-18 17:25:58,337 - epoch:7, training loss:14.4127 validation loss:2.0218
2025-12-18 17:26:01,814 - epoch:8, training loss:14.1648 validation loss:2.2066
2025-12-18 17:26:05,005 - epoch:9, training loss:14.1552 validation loss:2.0685
2025-12-18 17:26:08,241 - epoch:10, training loss:14.2726 validation loss:2.0897
2025-12-18 17:26:11,293 - epoch:11, training loss:14.1655 validation loss:2.1548
2025-12-18 17:26:14,535 - epoch:12, training loss:13.9110 validation loss:2.0578
2025-12-18 17:26:17,541 - epoch:13, training loss:13.8771 validation loss:2.1337
2025-12-18 17:26:18,731 - [*] loss:15.5326
2025-12-18 17:26:18,764 - [*] year 2017, testing
2025-12-18 17:26:18,948 - T:3	MAE	1.5956	RMSE	2.8341	MAPE	3.1408
2025-12-18 17:26:19,211 - T:6	MAE	1.7872	RMSE	3.3324	MAPE	3.5850
2025-12-18 17:26:20,324 - T:12	MAE	2.0586	RMSE	3.9957	MAPE	4.2205
2025-12-18 17:26:20,324 - T:Avg	MAE	1.7845	RMSE	3.3206	MAPE	3.5834
2025-12-18 17:26:20,325 - Finished optimization, total time:28.49 s, best model:log-common/PEMS04-Stream/topo_wo_mask-43/2017/2.0218.pkl
2025-12-18 17:26:20,347 - 

Evaluation Metrics Across Years:
2025-12-18 17:26:20,348 - 3   	MAE	      1.31	      1.24	      1.52	      1.40	      1.40	      1.64	      1.60		    1.44
2025-12-18 17:26:20,348 - 3   	RMSE	      2.39	      2.28	      2.65	      2.39	      2.52	      2.86	      2.83		    2.56
2025-12-18 17:26:20,348 - 3   	MAPE	      2.49	      2.31	      3.03	      2.58	      2.72	      3.43	      3.14		    2.81
2025-12-18 17:26:20,348 - 6   	MAE	      1.45	      1.40	      1.75	      1.58	      1.60	      1.86	      1.79		    1.63
2025-12-18 17:26:20,348 - 6   	RMSE	      2.81	      2.74	      3.18	      2.93	      3.05	      3.44	      3.33		    3.07
2025-12-18 17:26:20,348 - 6   	MAPE	      2.84	      2.68	      3.55	      3.00	      3.18	      4.00	      3.59		    3.26
2025-12-18 17:26:20,348 - 12  	MAE	      1.66	      1.60	      2.08	      1.85	      1.90	      2.18	      2.06		    1.90
2025-12-18 17:26:20,348 - 12  	RMSE	      3.33	      3.32	      3.89	      3.63	      3.72	      4.20	      4.00		    3.73
2025-12-18 17:26:20,348 - 12  	MAPE	      3.32	      3.17	      4.34	      3.65	      3.86	      4.82	      4.22		    3.91
2025-12-18 17:26:20,348 - Avg 	MAE	      1.45	      1.39	      1.75	      1.58	      1.60	      1.86	      1.78		    1.63
2025-12-18 17:26:20,348 - Avg 	RMSE	      2.79	      2.72	      3.16	      2.91	      3.02	      3.42	      3.32		    3.05
2025-12-18 17:26:20,348 - Avg 	MAPE	      2.83	      2.67	      3.56	      3.01	      3.19	      4.00	      3.58		    3.26
2025-12-18 17:26:20,348 - 
Training Time Statistics:
2025-12-18 17:26:20,348 - Year 2011 | Total Time:    49.3198s | Avg/Epoch:     1.7614s | Epochs: 28
2025-12-18 17:26:20,348 - Year 2012 | Total Time:    32.6874s | Avg/Epoch:     1.8160s | Epochs: 18
2025-12-18 17:26:20,348 - Year 2013 | Total Time:    28.7896s | Avg/Epoch:     1.9193s | Epochs: 15
2025-12-18 17:26:20,348 - Year 2014 | Total Time:    35.6585s | Avg/Epoch:     1.8768s | Epochs: 19
2025-12-18 17:26:20,348 - Year 2015 | Total Time:    38.6097s | Avg/Epoch:     1.9305s | Epochs: 20
2025-12-18 17:26:20,348 - Year 2016 | Total Time:    34.5433s | Avg/Epoch:     1.9191s | Epochs: 18
2025-12-18 17:26:20,348 - Year 2017 | Total Time:    28.4912s | Avg/Epoch:     2.0351s | Epochs: 14
2025-12-18 17:26:20,349 - Total training time across all years: 248.0993s
